idiom,meaning,s_f,s_l,s_a
more heat than light,to cause anger or intense reaction but doesn't clarify anything,The heated debate generated more heat than light and left everyone confused,The malfunctioning light bulb generated more heat than light and needed to be replaced,generated more heat than light
my hands are full,someone is too busy or has too much going on to be able to do or become involved with anything else,"With three projects to manage and a presentation to prepare, my hands are full at the moment","Carrying a stack of books and a cup of coffee, my hands are full at the moment",my hands are full at the moment
nail biter,"a situation like a close contest, which induces anxiety or tension.",The final moments of the game were a real nail biter as both teams were neck and neck,"Watching her chew on her fingers during the movie, it was clear she was a real nail biter",a real nail biter
nail in the coffin,"an action/event that will help bring about the death, end, or failure of something or someone",His resignation letter put the final nail in the coffin for the company's future,The undertaker put the final nail in the coffin before lowering it into the ground,put the final nail in the coffin
never looked back,"after an event which changed your life for the better, you continue to be happy with the situation","She quit her job and started her own business, and she never looked back after that",He walked away from the haunted house and never looked back after that,never looked back after that
no spring chicken,Someone who's no longer young.,He realized he was not a spring chicken anymore when he couldn't keep up with the younger athletes,The farmer confirmed that the hen was not a spring chicken anymore as it had grown quite large,not a spring chicken anymore
not getting anywhere,to make no progress at all; not improving or advancing a particular situation,We were not getting anywhere with this project due to constant setbacks,"The car was stuck in the mud, and we were not getting anywhere with this vehicle",not getting anywhere with this
not hurt a fly or flea,"To not be able to cause harm to anyone, including even a tiny and insignificant insect.","Despite his intimidating appearance, he wouldn't hurt a fly and was very gentle",She was so careful with her bug collection that she wouldn't hurt a fly while handling them,wouldn't hurt a fly
not playing with a full deck,not mentally sound,His strange ideas made it seem like he was not playing with a full deck,"During the poker game, we discovered we were not playing with a full deck when the ace of spades appeared twice",not playing with a full deck
off grid,disconnected from municipal utility systems.,He decided to disconnect from social media and started living off grid,They built a cabin in the woods and started living off grid without electricity or running water,started living off grid
old hat,Someone who is old fashioned. The phrase can directly refer to old fashion too.,"She's an old hat at programming, having done it for years","He found an old hat at the back of his closet, covered in dust",an old hat at
old school,old fashioned ideas or approach compared to current trends,"He prefers an old school approach to communication, like writing letters",The museum showcased an old school approach to education with antique desks and chalkboards,an old school approach
on a silver platter,to get something without having to work for it,He served it on a silver platter by doing all the work for her,The waiter served it on a silver platter to impress the guests,served it on a silver platter
on its knees,something that is in a very weak situation or on the verge of failure,"After the economic crisis, the city was on its knees and struggling to recover","In the art installation, the city was on its knees as the artist had created a miniature version of it, resting on two large sculptures of human knees",the city was on its knees
on pins and needles,being anxious or nervous,"While anticipating the exam results, we were waiting on pins and needles","During the acupressure therapy session, she was waiting on pins and needles placed on her back",waiting on pins and needles
on the back burner,to put something (that is to be done) for later,"Due to the urgent tasks, we had to put it on the back burner for now","To simmer the sauce slowly, she put it on the back burner of the stove",put it on the back burner
on the brink of,to be on the verge of doing something,The company was on the brink of something big when they launched their new product,"The hiker stood on the brink of something dangerous, a steep cliff",on the brink of something
on the crest of a wave,to reach the highest point of success,"After the successful product launch, the company was riding on the crest of a wave",The surfer skillfully balanced himself while riding on the crest of a wave,riding on the crest of a wave
on the edge of their seat,to be very interested in something and fits with both extremely exciting and nerve-wracking,The suspenseful movie had everyone on the edge of their seat,The chair was so small that they were uncomfortably perched on the edge of their seat,on the edge of their seat
on the hook,someone who is responsible for something,He was left on the hook for the entire project after his partner quit,The fish was left on the hook after it was caught,was left on the hook
on the line,to be at serious risk.,She put it on the line when she confronted her boss about the unfair treatment,She put it on the line to dry after washing her clothes,She put it on the line
on the money,being right about something.,His prediction about the game's outcome was right on the money,The coin landed right on the money that was placed on the table,right on the money
on the pig's back,a successful situation and everything is going well for that person,"After winning the lottery, he was riding on the pig's back and enjoying his newfound wealth","At the farm, the child was riding on the pig's back for fun",was riding on the pig's back
on the same page,everyone in agreement,"Before starting the project, we need to be on the same page regarding our goals","While reading the book together, they happened to be on the same page",be on the same page
open old wounds,"to revive memories of an unpleasant event, situation or dispute that took place in the past",Bringing up their past mistakes opened old wounds in the conversation,The surgeon opened old wounds to remove the remaining infection,opened old wounds
out of hand,out of control,The party got out of hand when people started throwing food,The ball got out of hand when he accidentally dropped it,got out of hand
out of the closet,go public about something private or hidden,"After years of hiding his true self, he finally came out of the closet to his family",She came out of the closet after finding the perfect outfit to wear,came out of the closet
out of the frying pan into the fire,to go from a bad to worse situation,"By quitting her job without a backup plan, she jumped out of the frying pan into the fire",The fish jumped out of the frying pan into the fire when the cook wasn't paying attention,jumped out of the frying pan into the fire
out on the town,go out and enjoy yourself at one or more places in the town,They were excited about going out on the town to celebrate their anniversary,The mayor was going out on the town to inspect the new infrastructure,going out on the town
over my dead body,"in no way, under no circumstances","He smirked and said, 'over my dead body will you ever beat me in a race'",The cat walked over my dead body in the crime scene simulation,over my dead body
over the moon,extremely pleased or happy,She was over the moon about the news of her promotion,The astronaut floated over the moon about the news of a successful mission,over the moon about the news
paddle own canoe,To be able to act without having to depend on anyone.,They decided to paddle their own canoe and start their own business,They had to paddle their own canoe to reach the other side of the lake,to paddle their own canoe
paint the town red,to celebrate and have a wild time,"After winning the championship, they decided to paint the town red together and celebrate","As part of a community art project, they decided to paint the town red together by covering the walls with vibrant murals",to paint the town red together
pass away,die,Our beloved grandmother passed away peacefully in her sleep,"The storm passed away peacefully, leaving a calm and clear sky",passed away peacefully
pass on the baton,give responsibility for something important to another person.,The retiring CEO passed on the baton to her as the new leader of the company,"During the relay race, he passed on the baton to her for the next lap",passed on the baton to her
pass the buck,passing blame to another person,"He didn't want to take responsibility, so he passed the buck to her",He handed her a dollar bill and passed the buck to her,passed the buck to her
pass the torch,to pass on the responsibility,The retiring CEO passed the torch to her as the new leader of the company,"During the relay race, he passed the torch to her for the next lap",passed the torch to her
pie in the sky,used to portray or refer to something that is lovely to consider however is probably not going to happen,His plan to become a millionaire overnight was just a pie in the sky,The artist painted a pie in the sky to represent the whimsical nature of dreams,a pie in the sky
piece of work,"a complex, tricky, or odd person","He was a real piece of work, always causing trouble and stirring up drama","The sculpture she created was a real piece of work, showcasing her artistic talent",a real piece of work
pipe down,to take to one or more notches down to its current standard,The teacher told them to pipe down when they were being too loud,The plumber told them to pipe down the water pressure to avoid leaks,told them to pipe down
play cat and mouse,to play with or tease someone,The detective played cat and mouse with the suspect to get a confession,The children played cat and mouse by pretending to be animals in their game,played cat and mouse
playing second fiddle,to play a secondary or minor role with regards to someone else,He didn't like playing second fiddle to her in the company hierarchy,"In the orchestra, he was playing second fiddle to her during the performance",playing second fiddle to her
plays with fire,people who take unnecessary risks or behave in a dangerous way,She plays with fire by constantly challenging her boss 's authority,"As a professional fire performer, she plays with fire during her shows",She plays with fire
prick up ears,to start paying attention,"When the speaker mentioned a new opportunity, the audience pricked up their ears",The dog pricked up their ears when they heard a strange noise outside,pricked up their ears
pull a rabbit out of the hat,do something unexpected or surprising,Our team pulled a rabbit out of the hat by winning the game in the last minute,The magician pulled a rabbit out of the hat during his performance,pulled a rabbit out of the hat
pull leg,tease someone,"When he told me I won the lottery, I thought he was pulling my leg","During the therapy session, the therapist was pulling my leg to stretch my muscles",was pulling my leg
pull the plug,to kill or discontinue,"Due to budget constraints, the management decided to pull the plug on the project","To save electricity, she decided to pull the plug on the projector's power cord",pull the plug on the project
pull the wool over eyes,to deceive someone,They pulled the wool over her eyes by pretending to be a wealthy businessman,"During the surprise party preparations, they pulled the wool over her eyes with a blindfold",They pulled the wool over her eyes
pull your socks up,to be determined to work very hard,"If you want to pass the exam, you need to pull your socks up and study harder","Before putting on your shoes, don't forget to pull your socks up",to pull your socks up
push the boat out,celebrate; enjoy oneself.,"For her birthday, we pushed the boat out and threw a huge party",We pushed the boat out into the water to start our fishing trip,we pushed the boat out
put a sock in it,to ask someone to stop talking,"He was talking too much, so I told him to put a sock in it","The hole in the wall was letting in cold air, so I decided to put a sock in it",to put a sock in it
put cards on the table,be open and honest,"During the meeting, they put their cards on the table and discussed their true intentions","In the middle of the poker game, they put their cards on the table to reveal their hands",they put their cards on the table
put his heart into,to be very enthusiastic and invest a lot of energy and hard work in something,He put his heart into the project and worked tirelessly to make it a success,"As a bizarre art installation, he put his heart into the project by placing a replica of a human heart in the center",He put his heart into the project
put the cart before the horse,to do things in the wrong order or sequence,"By focusing on the design before understanding the requirements, they were putting the cart before the horse","In a moment of confusion, the farmer accidentally started putting the cart before the horse",putting the cart before the horse
put the clock back,change to a lower level or earlier time.,He wished he could put the clock back an hour to avoid the embarrassing situation,"Due to daylight saving time, we had to put the clock back an hour",put the clock back an hour
put your foot in it,"say something (by mistake) that upsets, humiliates, or embarrasses someone","When you mentioned her ex, you really put your foot in it",Be careful not to put your foot in it when stepping over the muddy puddle,put your foot in it
put your head on the block,if you put yourself in a dangerous situation where you risk losing your job or your reputation if things go wrong,He put his head on the block by taking responsibility for the team's failure,"During the historical reenactment, he put his head on the block for the execution scene",He put his head on the block
queer pitch,spoil somebody's chance of doing something.,The salesman made a queer pitch by offering a bizarre combination of products,The baseball player made a queer pitch by throwing the ball in an unusual manner,made a queer pitch
rain or shine,Doing something regularly regardless of the circumstances.,"No matter the obstacles, rain or shine, we'll be there to support you","Regardless of the weather conditions, rain or shine, we'll be there for the outdoor event","rain or shine, we'll be there"
raise eyebrows,to show surprise or disapproval by the expression on their face,His controversial statement raised eyebrows at the meeting,The instructor asked everyone to raised eyebrows at the meeting as a facial exercise,raised eyebrows at the meeting
raise the bar,to be better than what went before,Her outstanding performance raised the bar for everyone in the competition,The high jump coach raised the bar for everyone during practice,raised the bar for everyone
rats in the attic,someone who is bit mad or that their behaviour is eccentric,"They always seemed a bit off, as if they found rats in the attic","When they went up to clean, they found rats in the attic",they found rats in the attic
ray of sunshine,someone or something that brings hope into the lives of others,Her positive attitude was a ray of sunshine in the room during the meeting,The window allowed a ray of sunshine in the room to brighten the space,a ray of sunshine in the room
ready to drop,to be extremely tired and nearly too exhausted to stay standing,"After working for 12 hours straight, he looked ready to drop",The overripe fruit on the tree looked ready to drop any moment,looked ready to drop
recharge one's batteries,take a break or holiday to relax and regain one's vim and vigour,They went on a vacation to recharge their batteries and regain their energy,They plugged in their devices to recharge their batteries before leaving the house,to recharge their batteries
red herring,something irrelevant that distracts you from something important,The detective found a red herring in the suspect's alibi,"While exploring the fish market, we found a red herring among the seafood",found a red herring
ring a bell,something that sounds familiar,Mentioning the old restaurant seemed to ring a bell for them,The teacher asked me to ring a bell for them to signal the end of recess,to ring a bell for them
rip off,the act of stealing,The plagiarized book seemed to rip off the cover of the original work,"With a strong pull, he managed to rip off the cover of the old book",to rip off the cover
rise and shine,to ask someone to wake up and become active in the daily chores,"It's a new day, rise and shine and make the most of it","As the sun began to rise and shine, it illuminated the morning sky",rise and shine
rock the boat,to make trouble.,"By questioning the company's policies, he rocked the boat a bit among his colleagues","As they leaned over the side to take a picture, they accidentally rocked the boat a bit",rocked the boat a bit
roots run deep,"similar in meaning to ""deep-rooted.""","In this small town, their roots run deep and everyone knows each other",The oak tree in the park is so old that their roots run deep underground,their roots run deep
rub shoulders,"to meet and spend time with people, especially when they are powerful or famous","At the gala, she rubbed shoulders with the famous and made valuable connections","During the crowded bus ride, he accidentally rubbed shoulders with the famous actress",rubbed shoulders with the famous
rub the wrong way,to tick someone off,Her sarcastic comments rubbed him the wrong way and made him feel uncomfortable,She accidentally rubbed him the wrong way while trying to give him a back massage,rubbed him the wrong way
run across,meet someone by accident,"While researching, I happened to run across the field of quantum physics","During the soccer match, the players had to run across the field to reach the ball",to run across the field
run out,to not have enough of something,We need to hurry or we'll run out of time to finish the project,"The clock's battery died, causing it to run out of time",run out of time
run out of steam,to lose the effect that something once had,"After working on the project for hours, she finally ran out of steam and took a break",The old steam engine ran out of steam and came to a halt,ran out of steam
sail through,to succeed in doing it without difficulty,"With her determination and hard work, she managed to sail through the challenges of her new job",The experienced captain was able to sail through the challenges of the stormy sea,to sail through the challenges
scratch the surface,to deal with only a small part of a problem,"During the lecture, we only scratched the surface of the topic and didn't dive deep","With a coin, she scratched the surface of the lottery ticket to reveal the numbers",scratched the surface
second wind,another burst of energy when you had been too tired to finish,"After a short break, the marathon runner found a second wind and continued running","While searching through the attic, he found a second wind chime to add to his collection",found a second wind
see eye to eye,to agree fully with someone,"After discussing our differences, we started seeing eye to eye with her","During the staring contest, we were seeing eye to eye with her",seeing eye to eye with her
see the light,realise or understand something,"After struggling with the problem for hours, he finally saw the light and found the solution","After being in the dark cave for hours, they finally saw the light when they reached the exit",finally saw the light
set the bar,fix the standards acceptable for the task,She set the bar high for her colleagues with her outstanding performance,The coach set the bar high for the high jump competition,set the bar high
shades of grey,refers to a situation where things are not really clear,"In the complex political situation, they saw shades of grey rather than a clear right or wrong","As an artist, they saw shades of grey when mixing black and white paint",they saw shades of grey
shake a leg,"to go fast, hurry","We were running late, so our mom told us to start shaking a leg","During the dance class, the instructor demonstrated shaking a leg to the rhythm",shaking a leg
shoot from the hip,"speak directly or bluntly, without caring for consequences","During the debate, he was shooting from the hip with his quick responses","At the shooting range, he practiced shooting from the hip to improve his accuracy",shooting from the hip
short fuse,to get angry quickly.,"Be careful around him, he has a short fuse and gets angry easily","The firecracker has a short fuse, so it will explode quickly after lighting it",has a short fuse
shot in the dark,an attempt to guess something when you have no information or knowledge about the subject and therefore cannot possibly know what the answer is,"Without any information, he took a shot in the dark and guessed the answer","During the blackout, he took a shot in the dark with his camera",he took a shot in the dark
show the door,make it clear that somebody must leave,"When he started making inappropriate comments, the manager showed him the door","Since he was lost in the building, she kindly showed him the door to exit",showed him the door
show true colors,to reveal what one is really like,"When the pressure was on, they showed their true colors and revealed their true intentions",The chameleon showed their true colors when it stopped blending in with the environment,showed their true colors
silver spoon,having a rich or privileged background,"He was born with a silver spoon in his mouth, inheriting a fortune from his family","In a unique family tradition, every child was born with a silver spoon placed beside them",was born with a silver spoon
sink or swim,"having to do something alone, and their success or failure depends entirely on their own efforts",Starting a new job without any training was a sink or swim situation for her,"When thrown into the deep end of the pool, it was a sink or swim situation for the inexperienced swimmer",a sink or swim situation
sit on the fence,delay or avoid making a decision or choice,"When it came to choosing a side, he was always sitting on the fence",The cat was sitting on the fence and observing the birds,sitting on the fence
sit tight,wait patiently,The manager told us to sit tight and wait for further instructions,The roller coaster operator instructed us to sit tight and wait for the ride to start,to sit tight and wait
skating on thin ice,to do something considered quite dangerous or risky,"By constantly arriving late to work, he was skating on thin ice with his boss","Despite the danger, they were skating on thin ice on the frozen lake",skating on thin ice
skeleton in the closet,"a secret of an embarrassing, guilty or shameful nature that you don't want to disclose","When digging into his past, we discovered a skeleton in the closet that he had been hiding","While exploring the haunted house, we discovered a skeleton in the closet of one of the rooms",we discovered a skeleton in the closet
smell a rat,sense that something is not right,He smelled a rat in the situation when his colleague started acting suspiciously,The exterminator smelled a rat in the situation and began searching for its nest,smelled a rat in the situation
smell something fishy,to have a suspicion that something is wrong,"When he started avoiding my questions, I smelled something fishy about his story","Walking past the seafood market, I smelled something fishy in the air",I smelled something fishy
smooth sailing,easy progress without impediment or difficulty,"Once we resolved the initial issues, we could experience smooth sailing throughout the project","On a calm day at sea, the boat would experience smooth sailing without any turbulence",experience smooth sailing
snake in the grass,a hidden army,She found a snake in the grass when she discovered her friend 's betrayal,"While walking through the field, she found a snake in the grass slithering away",She found a snake in the grass
snake in the shoes,to be in a state of fear,He found a snake in the shoes when he discovered his best friend was betraying him,"While cleaning the garage, he found a snake in the shoes he had left there",He found a snake in the shoes
snow under,to bury or cover something or somebody in the snow (Literal meaning),"During the busy season, she was snowed under with work and had no time for leisure",The unexpected blizzard left her car snowed under with work to dig it out,snowed under with work
spanner in the works,a roadblock that prevents an activity from succeeding,The sudden power outage threw a spanner in the works of our presentation,The mechanic accidentally dropped a spanner in the works of the machine,a spanner in the works
spill the beans,disclose a secret or reveal something prematurely,He accidentally spilled the beans about the surprise party we had planned,"While carrying a bag of legumes, she tripped and spilled the beans about the surprise on the floor",spilled the beans about the surprise
spin a yarn,to tell a tale,They spun a yarn together about their adventurous trip to the mountains,The two knitters spun a yarn together to create a beautiful scarf,spun a yarn together
stab in the back,a disloyalty,He was stabbed in the back by a friend when they revealed his secrets,"During the reenactment of a historical battle, he was accidentally stabbed in the back by a friend",stabbed in the back by a friend
stand out,extend beyond or above a surface,Her unique fashion sense made her stand out in the crowd,He had to stand out in the crowd to get a better view of the stage,stand out in the crowd
