idiom,meaning,s_f,s_l,s_a
Achilles heel,a vulnerable spot or weakness,"Despite his intelligence, procrastination was his Achilles heel","During the anatomy class, we studied his Achilles heel and its function",his Achilles heel
"Mr Right, Ms Right",the best future life partner for someone,"After years of searching, they finally found their Mr Right and Ms Right and settled down","At the costume party, they found their Mr Right and Ms Right outfits in the store",found their Mr Right and Ms Right
Young Turk,a young person who has many new ideas and wants a reform,He quickly became a Young Turk in the company due to his innovative ideas,"The new employee was a Young Turk in the company, having recently moved from Turkey",a Young Turk in the company
a bird in the hand,a possession that is worthy,"He decided to accept the job offer, believing that a bird in the hand is worth two in the bush","Holding a bird in the hand, she carefully examined its feathers",a bird in the hand
a cuckoo in the nest,an unwelcome intruder in a place or situation.,"When the new employee started causing problems, they realized they had found a cuckoo in the nest","While observing the bird's nest, the ornithologist found a cuckoo in the nest",found a cuckoo in the nest
a hard nut to crack,a problem that is difficult to solve,The mysterious case was a hard nut to crack for the detective,The thick shell made the walnut a hard nut to crack with bare hands,a hard nut to crack
a lot on my plate,to have so many things to do at one time,"Juggling multiple projects at work, she was having a lot on the plate these days","At the potluck dinner, he was having a lot on the plate after trying a bit of everything",was having a lot on the plate
a roof over your head,a place to live,Finding a job is essential for having a roof over your head,"During the rainstorm, having a roof over your head kept you dry",having a roof over your head
a screw loose,someone who behaves in a strange way and seem slightly mentally ill,He has a screw loose if he thinks he can quit his job without consequences,The wobbly table has a screw loose and needs to be fixed,has a screw loose
a wakeup call,something that makes you realize that you need to take action to change a situation,"After failing the exam, she received a wakeup call to study harder",She received a wakeup call from the hotel's front desk at 6 a.m.,she received a wakeup call
a wet blanket,a person who spoils other people's fun.,"He was always being a wet blanket at parties, constantly complaining","After the rainstorm, the picnic blanket was being a wet blanket on the ground",being a wet blanket
a whale of,very big (piece) of something,We had a whale of a time at the amusement park,The marine biologist had a whale of a time studying the humpback's behavior,had a whale of a time
a whole new ball game,a significant change in circumstances.,"After the company's merger, it's a whole new ball game for the employees","When they switched from soccer to baseball, it's a whole new ball game for the players",it's a whole new ball game
a witch hunt,an attempt to find and punish people whose opinions are unpopular and who are said to be a danger to society,The company started a witch hunt to find the person responsible for the leak,"During the historical reenactment, they started a witch hunt to portray the events accurately",started a witch hunt
acid test,a test that proves a hypothesis or validity of a product or idea,Moving in together was the acid test for their relationship to see if they could handle living with each other,The chemistry lab experiment was the acid test for their relationship as they had to work together to determine the pH of various solutions,the acid test for their relationship
across the board,applying to everyone,The company saw improvements across the board after implementing new strategies,The chess master made improvements across the board by adjusting the positions of his pieces,improvements across the board
add fuel to the flames,"an action, whether verbal or physical that makes a bad situation even worse","By spreading rumors, they added fuel to the flames of the ongoing conflict","To keep the bonfire going, they added fuel to the flames by throwing more wood",they added fuel to the flames
against the clock,in a great hurry to finish something before a particular time,"With the deadline approaching, we were racing against the clock to finish the project","In the unique competition, participants were racing against the clock by trying to outrun a giant clock on wheels",were racing against the clock
against the grain,a difficult path to be followed,His decision to quit his job was going against the grain of his family's expectations,"When sanding wood, going against the grain can cause scratches and damage",going against the grain
ahead of the curve,better than others,"By constantly learning new skills, she was staying ahead of the curve in her industry",The race car driver was staying ahead of the curve by maintaining a lead on the track,was staying ahead of the curve
ahead of the pack,more successful than other people who are trying to achieve the same things,"By consistently innovating, the company is staying ahead of the pack in the industry","During the marathon, the lead runner was staying ahead of the pack of other runners",staying ahead of the pack
air their dirty laundry,to make public something embarrassing that should be kept secret,"During the family reunion, they aired their dirty laundry in front of everyone",They aired their dirty laundry outside on the clothesline,they aired their dirty laundry
all Greek to me,used to convey that you cannot understand what is being said or written,"When he started talking about quantum physics, it's all Greek to me","Since I don't understand the language, when I read the Greek newspaper, it's all Greek to me",it's all Greek to me
all ears,saying that you are all ears means the other person has got your full attention in terms of listening to him,"When she started telling her story, I promised to be all ears","In the surreal art exhibit, the walls appeared to be all ears",be all ears
all the rage,when something is the height of popularity,"In the 90s, the new fashion trend was all the rage among teenagers","When the store ran out of stock, the new fashion trend was all the rage as customers angrily demanded more",the new fashion trend was all the rage
all the way up,"Literally refers to ascending a mountain or cliff, or navigating a river to a specific terminal point.",Her career went all the way up after she landed a major role in a blockbuster movie,The elevator went all the way up to the top floor of the building,went all the way up
an item,be involved in a romantic relationship,"After months of dating, they finally became an item and made their relationship official","In the virtual reality game, the player's avatar became an item to be collected by others",became an item
ants in pants,be extremely restless,He had ants in his pants and couldn't focus on the presentation,"While picnicking, he accidentally sat on an anthill and had ants in his pants",had ants in his pants
apple polisher,a flatterer; toady,He got the promotion by being an apple polisher and constantly flattering the boss,She took up the job of being an apple polisher at the fruit market,being an apple polisher
apples to apples,having a fair comparison between the two things,"To make a fair judgment, we need to compare apples to apples in this situation","In the fruit market, we had to compare apples to apples to find the best quality",to compare apples to apples
arm in arm,to be closely allied,The two companies walked arm in arm in their joint venture,"The couple walked arm in arm down the street, enjoying the evening",walked arm in arm
as far as,to the extent of something,His influence extends as far as the eye can see in the business world,The vast desert stretched out as far as the eye can see,as far as the eye can see
as long as,to put condition of time on an action,His patience was as long as the rope when dealing with difficult customers,The snake was as long as the rope lying next to it,as long as the rope
asked for the moon,ask for something that is very difficult or impossible to get,He asked for the moon when he requested a million-dollar salary,"The child, fascinated by astronomy, playfully asked for the moon as a birthday gift",asked for the moon
asleep at the switch,failing to attend to one's responsibilities or duties,The manager was asleep at the switch when the crisis occurred,The train operator fell asleep at the switch during his break,asleep at the switch
asleep at the wheel,"when someone is not sufficiently attentive, especially at a critical moment when vigilance is required",The manager was asleep at the wheel when the company lost a major client,He was so exhausted that he fell asleep at the wheel while driving,asleep at the wheel
at an arm's length,as far away from your body as possible,She kept it at an arm's length to avoid getting too involved in the situation,He kept it at an arm's length to prevent the paint from smudging his clothes,kept it at an arm's length
at daggers drawn,almost ready to fight,The two politicians were at daggers drawn with each other during the debate,The actors were at daggers drawn with each other during the stage fight scene,at daggers drawn with each other
at the bottom of the ladder,"occupying the lowest, most basic position in a given group",She started at the bottom of the ladder in the company and worked her way up,"Before climbing, she started at the bottom of the ladder and checked each rung for stability",She started at the bottom of the ladder
at the drop of a dime,something that can happen very fast without hesitation,Our team is always ready at the drop of a dime to tackle any challenge,The coin collector was ready at the drop of a dime to catch the rare coin,ready at the drop of a dime
at the drop of the hat,to do something easily and without any preparation,She was always ready at the drop of a hat to help her friends,"As a professional hat catcher, he was ready at the drop of a hat to catch any falling hats",ready at the drop of a hat
at the helm,"in charge of an organization, group of people, etc.","She was at the helm of the project, guiding the team to success","The captain stood at the helm of the project, steering the ship through the storm",at the helm of the project
ate her alive,to criticize someone severely because you are angry with them,The guilt of lying to her best friend it ate her alive for days,"In the horror movie, the monster found her hiding spot and it ate her alive",it ate her alive
axe to grind,have a private or selfish reason for doing something,He had an axe to grind with his coworker after the disagreement,The lumberjack had an axe to grind before chopping down the tree,had an axe to grind
back against the wall,to be in a tough situation with limited options,"With no other options left, he had his back against the wall and had to make a decision",He had his back against the wall while waiting for the elevator,he had his back against the wall
back the wrong horse,to make the wrong decision and support a person or action that is later unsuccessful,She backed the wrong horse when she supported the losing candidate,"At the racetrack, she backed the wrong horse and lost her bet",She backed the wrong horse
backroom boy(s),people who work in anonymity,The company's success was largely due to the backroom boys who worked tirelessly behind the scenes,"In the storage area, the backroom boys were busy organizing and restocking shelves",the backroom boys
bad egg,someone who fails to meet expectations,"Despite his charming demeanor, he turned out to be a bad egg in the company",The carton of eggs we bought turned out to be a bad egg when we cracked it open,turned out to be a bad egg
ball and chain,a burden or problem that ties you down and prevents you from doing what you want,He felt like he was carrying a ball and chain with his overwhelming responsibilities,The prisoner was carrying a ball and chain as a part of his punishment,was carrying a ball and chain
bare bones,most basic and important elements or facts,"During the meeting, she presented the bare bones of the project plan",The archaeologist presented the bare bones of the ancient skeleton,presented the bare bones
bark up the wrong tree,waste one's efforts by pursuing the wrong thing or path,Accusing her of stealing the documents was barking up the wrong tree,"The confused dog was barking up the wrong tree, as the squirrel had already moved to another one",was barking up the wrong tree
bats in the belfry,to be silly and slightly crazy and behave in a confused way,His wild theories and peculiar behavior made others think he had bats in the belfry,The old church tower had bats in the belfry that flew out at dusk,had bats in the belfry
batten down the hatches,to get ready for trouble,"When the company announced layoffs, employees had to batten down the hatches and prepare for the worst","As the storm approached, the sailors rushed to batten down the hatches on the ship",to batten down the hatches
baying for blood,want somebody to be hurt or punished.,The angry mob was baying for blood after the politician's scandal,The pack of hungry wolves was baying for blood as they hunted their prey,baying for blood
be on a collision course,doing or saying things which are certain to cause a serious disagreement or a fight between them.,Their opposing political views put them on a collision course with each other,"The two ships, sailing at full speed, were on a collision course with each other",on a collision course with each other
beat around the bush,avoid talking about the main topic,"If you have something to say, just stop beating around the bush and tell me","If you want to trim the garden, stop beating around the bush and start cutting it",stop beating around the bush
beat the drum,to speak eagerly about something you support,He tirelessly beat the drum for the cause to raise awareness about climate change,The musician beat the drum for the cause during the charity concert,beat the drum for the cause
bee in bonnet,be possessed with one thought or scheme,She had a bee in her bonnet about the new policy changes,"During the picnic, she accidentally had a bee in her bonnet and panicked",had a bee in her bonnet
been tailor made,specially made for a particular purpose,The job opportunity has been tailor made for her skills and experience,The suit has been tailor made to fit his measurements perfectly,has been tailor made
begun to see the light,to suddenly begin to understand,"After hours of studying, he finally began to see the light and understood the concept","As the sun rose, she began to see the light streaming through the window",began to see the light
behind closed doors,in clandestine,The board members discussed the matter behind closed doors to maintain confidentiality,"They stood behind closed doors while discussing the matter, as the room was too noisy",behind closed doors
being bouncing off the walls,excited and full of nervous energy,The kids were bouncing off the walls after eating too much candy,The rubber ball kept bouncing off the walls in the small room,bouncing off the walls
bend over backwards,do all in one's power (usually to achieve something or accommodate somebody),I always bend over backwards for them to make sure they're happy,"During the yoga class, we had to bend over backwards for them to demonstrate the pose",bend over backwards for them
bent out of shape,to become angry.,He got bent out of shape when he found out his favorite band was sold out,The metal rod got bent out of shape after the car accident,got bent out of shape
bent your ears,to talk to someone for a very long time about something boring,The speaker bent their ears with his captivating stories,The strong wind bent their ears as they walked through the storm,bent their ears
bet on the wrong horse,support a person or thing that ultimately fails,She bet on the wrong horse when she chose to invest in that failing company,"At the racetrack, she bet on the wrong horse and lost her money",She bet on the wrong horse
between a rock and a hard place,having two very bad choices,He was caught between a rock and a hard place when he had to choose between his job and his family,"While hiking, she found herself caught between a rock and a hard place in a narrow passage",caught between a rock and a hard place
between you and me,a secret to be kept between two people,"Between you and me, there's a secret that I can't share with anyone else","He placed a mysterious box between you and me, there's a secret hidden inside it","Between you and me, there's a secret"
beyond the veil,"In an inexplicable or concealed place or condition, especially the mysterious state of existence after death.",The psychic claimed she looked beyond the veil and communicated with spirits,"Standing in front of the window, she looked beyond the veil and saw the beautiful garden",she looked beyond the veil
big brother,A large organization or government agency that tries to control all aspects of human life and society.,"With the new surveillance system, we felt like we were being watched by big brother","As the younger sibling, she was always watched by big brother during their childhood",watched by big brother
big cheese,to be an important and successful individual,"In the company, he's the big cheese and everyone respects him","At the cheese festival, they displayed the big cheese weighing over 100 pounds",the big cheese
big gun,a very powerful individual,"To solve the complex problem, we had to bring in the big gun from the head office","To defend the fort, they had to bring in the big gun from the armory",to bring in the big gun
big mouth,someone who talks too much,"He can't keep a secret, he has a big mouth",The hippopotamus has a big mouth to consume large amounts of food,has a big mouth
bigger fish to fry,"to have other, more important things to do.","I can't focus on this minor issue, I have bigger fish to fry at work","I can't cook these small ones now, I have bigger fish to fry for the dinner party",I have bigger fish to fry
bite head off,overreact in an angry or harsh way,She was so angry that she bit his head off when he tried to explain,The snake bit his head off when he got too close to its nest,bit his head off
bite off more than one can chew,"to try to do something that is too difficult for you, or more than you can manage","By accepting too many projects at once, he bit off more than he could chew",He bit off more than he could chew when he tried to eat the whole sandwich in one bite,he bit off more than he could chew
bite the hand that feed,to turn against someone who has been a benefactor in the past,"By criticizing her mentor, she bit the hand that fed her",The untrained dog bit the hand that fed him,bit the hand that fed
bits and pieces,miscellaneous small objects,"After the meeting, we gathered the bits and pieces of information to create a report","Following the vase's shattering, we gathered the bits and pieces from the floor",we gathered the bits and pieces
bitter medicine,something difficult to accept,The harsh criticism was a dose of bitter medicine that helped him improve,The doctor prescribed a dose of bitter medicine to treat his illness,a dose of bitter medicine
bitter pill,something unpleasant to be endured,He had to swallow a bitter pill when he realized he couldn't afford his dream car,The medicine was so awful that she had to swallow a bitter pill,to swallow a bitter pill
black and blue,"hurt, either bodily, emotionally or psychologically","After the harsh criticism, his ego was bruised black and blue",He fell off his bike and was bruised black and blue all over his body,was bruised black and blue
black book,a book containing a list of secret contacts,"After betraying his trust, she was found in the black book of his memories",The old photograph was found in the black book on the dusty shelf,was found in the black book
black hole,a place in which things are lost never to be seen again,"The inefficient department created a black hole in the system, draining resources",Scientists discovered a black hole in the system while observing the galaxy,a black hole in the system
black sheep,a disgrace,"Despite his successful siblings, John's unconventional career choice made him the black sheep in their midst","Among the white ones, there was the black sheep in their midst grazing in the field",the black sheep in their midst
blazing row,a very angry argument,The couple next door had a blazing row over their finances,The firefighters had a blazing row of flames to extinguish,had a blazing row
blind as a bat,unconscious to something,"Without his glasses, he's as blind as a bat and can't see anything","The cave-dwelling creature was as blind as a bat, relying on echolocation to navigate",as blind as a bat
blow away,impress someone very much,Their innovative product blew away the competition in the market,The strong gust of wind blew away the competition papers from the table,blew away the competition
blow cover,to reveal the true identity,The undercover agent blew their cover by accidentally revealing their true identity,The strong wind blew their cover off the outdoor furniture,blew their cover
blow his own horn,to talk about oneself or one's achievements especially in a way that shows pride or too much pride,He never hesitates to blow his own horn about his accomplishments,"As a trumpet player, he would blow his own horn during practice",blow his own horn
blow your own trumpet,to say things that makes your own self or kin look good,He was always blowing his own trumpet about his accomplishments,"During the parade, he was blowing his own trumpet as part of the marching band",blowing his own trumpet
blue blood,a member of an upper-class family,They were considered a blue blood family due to their aristocratic lineage,"In a bizarre science fiction world, they were a blue blood family with copper-based hemocyanin",a blue blood family
blue eyed boy,a person who is treated with special favor.,"He was the blue-eyed boy of the company, always receiving praise and promotions",The child with striking azure irises was the blue-eyed boy in the family,the blue-eyed boy
born yesterday,naive; inexperienced,He was not born yesterday and could easily see through their lies,"Since today is her first birthday, she was not born yesterday",not born yesterday
bread and butter,to indicate what a person earns or earns for,"Graphic design is their bread and butter, as it's their main source of income","On the table, there was their bread and butter ready for breakfast",their bread and butter
break a leg,good luck,"Before her performance, we told her to break a leg on stage","During the play, the actor accidentally tripped and managed to break a leg on stage",to break a leg on stage
break down,to stop working,"Let me break down the situation for you, so you can understand the complexity",The firefighters had to break down the situation by removing debris after the collapse,break down the situation
break the ice,"to do or say something that makes people feel more comfortable, especially at the start of a meeting or party",We started breaking the ice together by playing a fun team-building game,"During the winter expedition, we were breaking the ice together to clear a path",breaking the ice together
break the mould,to do something different from what is expected,Her innovative ideas were breaking the mould in the industry,The sculptor was breaking the mould to reveal the finished statue,breaking the mould
break up,end a romantic relationship with someone,"After months of arguments, they decided to break up and end their relationship",The construction workers decided to break up the concrete with a jackhammer,decided to break up
bright spark,an intelligent and lively person (humorously),"She was a bright spark in the team, always coming up with innovative ideas",The firework display created a bright spark in the night sky,a bright spark
buckle down,make sure something stays in place,"With the deadline approaching, we had to buckle down to work and finish the project",The carpenter had to buckle down to work on the leather belt,to buckle down to work
build bridges,to foster good relationships,"As a mediator, my goal is to build bridges between them and resolve their conflicts",The construction company was hired to build bridges between them to connect the two islands,to build bridges between them
building blocks,something that is a basic element (of the subject),Hard work and dedication are the building blocks of success,The children used wooden cubes as the building blocks of success in their tower construction,the building blocks of success
bun in the oven,to be pregnant,She excitedly announced that she has a bun in the oven and is expecting a baby,The baker has a bun in the oven and it will be ready in a few minutes,has a bun in the oven
burn bridges,"remove someone's all options of retreat, act decisively","After the argument, she burned bridges with them and never spoke to them again",The vandals burned bridges with them as they escaped the village,burned bridges with them
burn fingers,to bear an unpleasant result of an action that has been taken in the past,They burned their fingers by investing in a risky business,They burned their fingers while trying to grab a hot pan,They burned their fingers
burn the candle at both ends,to exhaust someone's energies or resources by leading a hectic life.,"Working two jobs and studying, she was burning the candle at both ends","During the experiment, they were burning the candle at both ends to observe the melting rate",burning the candle at both ends
